{
  "manifest_id": "m66_private_evidence_vault",
  "version": "0.1.0",
  "created_at": "2026-06-21T00:00:00Z",
  "status": "public_safe_private_vault_metadata",
  "evidence_class": "private_audit_metadata_public_safe",
  "vault_controls": {
    "vault_root": "private_evidence/",
    "private_reports_root": "reports/private/",
    "gitignore_path": ".gitignore",
    "vault_root_gitignored": true,
    "private_reports_root_gitignored": true,
    "raw_private_records_committable": false,
    "private_reports_committable": false,
    "public_derivatives_committable_after_redaction": true
  },
  "storage_plan": {
    "storage_mode": "ignored_local_directory",
    "encryption_plan": "optional_local_file_encryption_or_os_keychain_wrapped_key",
    "encryption_required_for_real_private_evidence": true,
    "key_material_committable": false,
    "secret_material_in_manifest": false,
    "credentials_required_for_fake_metadata": false,
    "live_secret_handling_in_quality_gate": false,
    "notes": "M66 records the storage plan only. Real private evidence should use local encryption or OS-keychain-wrapped key material outside Git; the deterministic gate handles fake metadata only."
  },
  "promotion_controls": {
    "promotion_command_status": "validation_only_promotions_blocked_until_m67",
    "redaction_metadata_required": true,
    "reviewer_signoff_required": true,
    "original_private_artifact_remains_local_only": true,
    "promoted_fixture_requires_public_safety_assertions": true,
    "private_evidence_public_ranking_eligible": false,
    "refused_without_redaction_metadata": true
  },
  "audit_report_controls": {
    "private_audit_report_root": "reports/private/",
    "required_report_label": "private_audit_report",
    "reports_generated_from_private_evidence_marked_private_audit": true,
    "private_audit_reports_gitignored": true,
    "public_leaderboard_eligible": false,
    "aggregate_export_default": false,
    "local_only_by_default": true
  },
  "quality_gate": {
    "deterministic_gate_validates_fake_metadata_only": true,
    "private_evidence_ingestion_in_quality_gate": false,
    "raw_private_data_read_in_quality_gate": false,
    "live_execution_in_quality_gate": false,
    "credential_handling_in_quality_gate": false,
    "provider_calls_in_quality_gate": false,
    "external_actions_in_quality_gate": false,
    "writes_private_data_to_committed_fixtures": false
  },
  "safety_assertions": {
    "public_safe": true,
    "fake_metadata_only": true,
    "contains_private_data": false,
    "credentials_required": false,
    "raw_private_logs": false,
    "private_workspace_paths": false,
    "real_customer_data": false,
    "live_execution": false,
    "external_actions": false
  },
  "private_records": [
    {
      "record_id": "fake_private_runtime_trace_001",
      "source_runtime": "hermes",
      "source_kind": "runtime_trace",
      "declared_evidence_class": "private_audit",
      "metadata_classification": "public_safe_fake_private_metadata",
      "artifact_data_classification": "private_runtime_evidence_local_only",
      "artifact_path": "private_evidence/fake_runtime_trace_001/raw_trace.local.jsonl",
      "artifact_path_gitignored": true,
      "artifact_content_in_manifest": false,
      "retention_class": "delete_after_review",
      "access_boundary": "local maintainer workstation only",
      "consent_or_authorization": "required_before_ingestion",
      "promotion_candidate": false,
      "promotion_status": "not_requested",
      "public_ranking_eligible": false,
      "private_audit_report_label": "private_audit_report",
      "redaction_metadata": {
        "metadata_present": true,
        "redaction_status": "not_started",
        "redaction_notes_path": "private_evidence/fake_runtime_trace_001/redaction_notes.local.json",
        "public_safe_derivative_path": "traces/external/fake_private_runtime_trace_001.reviewed.jsonl",
        "reviewer_signoff": false,
        "reviewer_id": "local_reviewer_required",
        "public_safety_assertions_present": false,
        "promotion_allowed": false
      },
      "safety_assertions": {
        "public_safe_metadata": true,
        "raw_private_content_in_manifest": false,
        "credentials_in_manifest": false,
        "raw_private_log_in_manifest": false,
        "private_workspace_path_in_manifest": false,
        "real_customer_data_in_manifest": false,
        "external_action_in_manifest": false
      }
    },
    {
      "record_id": "fake_private_tool_summary_001",
      "source_runtime": "openclaw",
      "source_kind": "tool_summary",
      "declared_evidence_class": "private_audit",
      "metadata_classification": "public_safe_fake_private_metadata",
      "artifact_data_classification": "private_runtime_evidence_local_only",
      "artifact_path": "private_evidence/fake_tool_summary_001/tool_summary.local.jsonl",
      "artifact_path_gitignored": true,
      "artifact_content_in_manifest": false,
      "retention_class": "retain_local_until_manually_deleted",
      "access_boundary": "local maintainer workstation only",
      "consent_or_authorization": "required_before_ingestion",
      "promotion_candidate": true,
      "promotion_status": "redaction_metadata_recorded_not_promoted",
      "public_ranking_eligible": false,
      "private_audit_report_label": "private_audit_report",
      "redaction_metadata": {
        "metadata_present": true,
        "redaction_status": "redaction_notes_stubbed",
        "redaction_notes_path": "private_evidence/fake_tool_summary_001/redaction_notes.local.json",
        "public_safe_derivative_path": "traces/external/fake_private_tool_summary_001.reviewed.jsonl",
        "reviewer_signoff": false,
        "reviewer_id": "local_reviewer_required",
        "public_safety_assertions_present": true,
        "promotion_allowed": false
      },
      "safety_assertions": {
        "public_safe_metadata": true,
        "raw_private_content_in_manifest": false,
        "credentials_in_manifest": false,
        "raw_private_log_in_manifest": false,
        "private_workspace_path_in_manifest": false,
        "real_customer_data_in_manifest": false,
        "external_action_in_manifest": false
      }
    }
  ]
}
